{
  "schema_version":"1.0",
  "id":"obs02.real-worker-lifecycle-accepted",
  "kind":"decision",
  "title":"Real worker actor lifecycle accepted for OBS-02",
  "summary":"A real OpenCode 1.14.48 / Qwen3.8 / llama.cpp worker demonstrated truthful TERM→OC→QWEN→LLAMA activity and terminal lifecycle on one correlation, including failure-path closure and idle-after-terminal behavior.",
  "status":"active",
  "claims":[
    "During live inference TERM, OC, QWEN and LLAMA were RUNNING on correlation corr:30b0bf97-d535-4f6b-a41a-43f9df816d01.",
    "The failure path closed TERM, OC, QWEN and LLAMA as ERROR on the same correlation.",
    "After termination all actor activity flags returned false.",
    "The Side Panel visually showed Last task, zero open spans, and terminal LLAMA/QWEN/OC/TERM spans."
  ],
  "decision":"Close OBS-02 actor activity/lifecycle truth at 100%; continue causal-provenance work under OBS-04/GW-01.",
  "rationale":"The remaining deficiencies concern correlation propagation and trace UX rather than actor activity truth.",
  "tags":["obs-02","observability","lifecycle","opencode","qwen","llama","correlation"],
  "entities":["Execution Delivery Harness","OpenCode 1.14.48","Qwen3.8-27B","llama.cpp"],
  "evidence":[
    {"type":"file","ref":"evidence/obs-02-worker-live-20261005.json","note":"Canonical machine-readable acceptance evidence."},
    {"type":"doc","ref":"docs/OBS-02-LIVE-ACCEPTANCE-2026-10-05.md","note":"Human-readable acceptance decision."},
    {"type":"file","ref":"artifacts/observer-worker-acceptance.txt","note":"Allowed artifact created by the real worker."}
  ],
  "supersedes":[],
  "created_at":"2026-10-05T05:53:00Z",
  "updated_at":"2026-10-05T05:53:00Z",
  "context":{"scope":"task","repo":{"name":"execution-delivery-harness","worktree":"_bridge-local-execution","branch":"chore/local-execution","head":"f9a50913fc5ebd3dd42435923e41677cbb813171"},"task_ids":["OBS-02"],"plan_id":"obs-02-real-worker-acceptance","run_id":"worker:OBS-02-WORKER-ACCEPT","source_artifacts":["TODO.md","evidence/obs-02-worker-live-20261005.json","docs/OBS-02-LIVE-ACCEPTANCE-2026-10-05.md","knowledge/events.jsonl"]}
}
