{
  "schema_version":"1.0",
  "id":"obs04.trace-ui-projection",
  "kind":"decision",
  "title":"Observer separates causal trace projection from raw unified timeline",
  "summary":"Chrome Observer trace-ui3 renders the active or most recent correlated chain as a dedicated Current/recent trace tree using span parentage, while Unified Timeline remains the raw event evidence stream.",
  "status":"active",
  "claims":[
    "The trace projection selects an active correlation first, otherwise the most recent correlated event.",
    "Trace rows are indented from span_id/parent_span_id ancestry.",
    "The trace header shows a short correlation prefix, event count and source_quality.",
    "Collapsed correlated raw timeline rows show a short correlation prefix.",
    "Raw MCP/TERM polling noise remains and is tracked separately under OBS-07."
  ],
  "decision":"Use the trace projection as the operator-facing causal view; keep Unified Timeline as drill-down evidence and compact its self-noise separately.",
  "rationale":"A flat 300-event stream is not a usable representation of one causal run even when every event is correctly correlated.",
  "tags":["obs-04","obs-07","observer","trace","timeline","correlation","ux"],
  "entities":["Execution Delivery Harness Observer","Unified Timeline","Current/recent trace"],
  "evidence":[
    {"type":"file","ref":"evidence/obs-04-trace-ui-20261005.json","note":"Trace UI implementation and test evidence."},
    {"type":"test","ref":"tests/extension.mjs","note":"Static UI contract verifies trace section, rendering function and correlation prefix."}
  ],
  "supersedes":[],
  "created_at":"2026-10-05T06:12:00Z",
  "updated_at":"2026-10-05T06:12:00Z",
  "context":{
    "scope":"task",
    "repo":{"name":"execution-delivery-harness","worktree":"_bridge-local-execution","branch":"chore/local-execution","head":"f9a50913fc5ebd3dd42435923e41677cbb813171"},
    "task_ids":["OBS-04","OBS-07"],
    "plan_id":null,
    "run_id":null,
    "source_artifacts":["TODO.md","evidence/obs-04-trace-ui-20261005.json","knowledge/events.jsonl"]
  }
}
